"text",
"and they all lived happily ever after",
"and they all died miserably.",
"and they all realized it was a dream.",
"and then the Rapture happened",
"but all of that was irrelvant",
"then the world exploded",
"and they were all eaten by Actual Cannibal Shia Leabouf",
"finally, they were able to establish the Fourth Reich",
"in the end, there was nothing left but Mexicans and Donald Trump",
"at last, they established the Fourth Reich",
"and Weez came and ended all of our fun",
"and it ended in an epic death battle where (C1) dies for (C3)",
