"text",
"Rick (C1), Morty (C2), and ________(C3) were running away from robot police from space...",
"Jack (C1) and Jill (C2) went up a hill to have a battle to the death with ________(C3)...",
"Super Joe (C1) and his archrival, Dr. Awkward, (C2) fight for the affection of ________(C3)...",
"Liam (C1) is building a robot, C4T4, (C2) to gain the respect of his professor, ________ (C3)...",
"Fisherman Sam (C1) just caught the rare Spadoodle Fish (C2) as a meal for ________(C3)...",
"but then, the group entered a filler arc where (C1) and (C3) joined a boy band",
"all of the sudden, (C2) was struck by a Gypsy cart",
"and, (C3) took an arrow to with knee",
"but, a carrot fell out of the sky and hit (C1)",
"and then, (C3) stood frozen in place, mezmorized by a colored chicken",
"and then the fires of Double-Hell cosumed (C2)'s soul and (C3) had to venture below to get it back",
"but then (C2) and (C1) went to earn the roles of Prom King and Queen together to fulfill their childhood dreams",
"and then (C1) out of the corner of their eyes they spot him, Actual Cannibal Shia Leabouf",
"but then (C3) revealed (C1)... I am your father.",
"but, suddenly, Jesus comes to challenge (C2) to a dance off",
"but then (C2) realized he wanted to join the speaking mime club",
"and then, due to hunger (C2) literally stole candy from a baby",
"and then (C2) challenged a nearby man to a street fight. And that man's name... was John Cena!",
"and then techno music start to play",
"and then they realized John Snow knows nothing",
"but then a man with a saxophone sooths them with his sexy tunes",
"and they all lived happily ever after",
"and they all died miserably.",
"and they all realized it was a dream.",
"and then the Rapture happened",
"but all of that was irrelvant",
"then the world exploded",
"then a Mexican standoff happened",
"and then the Fire Nation attacked.",
"and they were all eaten by Actual Cannibal Shia Leabouf",
